34029301,Equivalence between the Weyl-tensor and gauge-invariant graviton two-point functions in Minkowski and de Sitter spaces,14,2012,https://scholar.google.com/citations?view_op=view_citation&hl=en&user=iV38Wo0AAAAJ&cstart=20&pagesize=80&citation_for_view=iV38Wo0AAAAJ:lSLTfruPkqcC,Atsushi Higuchi,2012/4/7,arXiv preprint arXiv:1204.1684,,,['Atsushi Higuchi'],Atsushi Higuchi,
43837671,Quantum field theory in Lorentzian universes from nothing,14,1995,https://scholar.google.com/citations?view_op=view_citation&hl=en&user=iV38Wo0AAAAJ&cstart=20&pagesize=80&citation_for_view=iV38Wo0AAAAJ:ZeXyd9-uunAC,Atsushi Higuchi,1995/11/15,Physical Review D,,,"['John L Friedman', 'Atsushi Higuchi']",John L Friedman,['Atsushi Higuchi']
53209836,On-axis tidal forces in Kerr spacetime,13,2020,https://scholar.google.com/citations?view_op=view_citation&hl=en&user=iV38Wo0AAAAJ&cstart=20&pagesize=80&citation_for_view=iV38Wo0AAAAJ:8xutWZnSdmoC,Atsushi Higuchi,2020/3/1,The European Physical Journal Plus,,,"['Haroldo CD Lima Junior', 'Luís CB Crispino', 'Atsushi Higuchi']",Haroldo CD Lima Junior,"['Luís CB Crispino', 'Atsushi Higuchi']"
62861430,Classical and quantum radiation reaction in conformally flat spacetime,13,2009,https://scholar.google.com/citations?view_op=view_citation&hl=en&user=iV38Wo0AAAAJ&cstart=20&pagesize=80&citation_for_view=iV38Wo0AAAAJ:bEWYMUwI8FkC,Atsushi Higuchi,2009/5/28,Physical Review D,,,"['Atsushi Higuchi', 'Philip James Walker']",Atsushi Higuchi,['Philip James Walker']
49222821,Symmetry and internal time on the superspace of asymptotically flat geometries,13,1990,https://scholar.google.com/citations?view_op=view_citation&hl=en&user=iV38Wo0AAAAJ&cstart=20&pagesize=80&citation_for_view=iV38Wo0AAAAJ:qUcmZB5y_30C,Atsushi Higuchi,1990/4/15,Physical Review D,,,"['John L Friedman', 'Atsushi Higuchi']",John L Friedman,['Atsushi Higuchi']
41276839,Massive symmetric tensor field in curved spacetime,13,1989,https://scholar.google.com/citations?view_op=view_citation&hl=en&user=iV38Wo0AAAAJ&cstart=20&pagesize=80&citation_for_view=iV38Wo0AAAAJ:iH-uZ7U-co4C,Atsushi Higuchi,1989/3/1,Classical and Quantum Gravity,,,['Atsushi Higuchi'],Atsushi Higuchi,
80034003,First order formulation and geometrical interpretation of D= 11 supergravity,13,1984,https://scholar.google.com/citations?view_op=view_citation&hl=en&user=iV38Wo0AAAAJ&cstart=20&pagesize=80&citation_for_view=iV38Wo0AAAAJ:ML0RJ9NH7IQC,Atsushi Higuchi,1984/9/27,Physics Letters B,,,"['Itzhak Bars', 'A Higuchi']",Itzhak Bars,['A Higuchi']
35782147,Vacuum state in de Sitter spacetime with static charts,12,2018,https://scholar.google.com/citations?view_op=view_citation&hl=en&user=iV38Wo0AAAAJ&cstart=20&pagesize=80&citation_for_view=iV38Wo0AAAAJ:9pM33mqn1YgC,Atsushi Higuchi,2018/9/25,Physical Review D,,,"['Atsushi Higuchi', 'Kazuhiro Yamamoto']",Atsushi Higuchi,['Kazuhiro Yamamoto']
35105319,Infrared divergences for free quantum fields in cosmological spacetimes,12,2018,https://scholar.google.com/citations?view_op=view_citation&hl=en&user=iV38Wo0AAAAJ&cstart=20&pagesize=80&citation_for_view=iV38Wo0AAAAJ:M7yex6snE4oC,Atsushi Higuchi,2018/4/30,Classical and Quantum Gravity,,,"['Atsushi Higuchi', 'Nicola Rendell']",Atsushi Higuchi,['Nicola Rendell']
84610128,Mode-sum construction of the covariant graviton two-point function in the Poincaré patch of de Sitter space,12,2016,https://scholar.google.com/citations?view_op=view_citation&hl=en&user=iV38Wo0AAAAJ&cstart=20&pagesize=80&citation_for_view=iV38Wo0AAAAJ:9Nmd_mFXekcC,Atsushi Higuchi,2016/6/2,Physical Review D,,,"['Markus B Fröb', 'Atsushi Higuchi', 'William CC Lima']",Markus B Fröb,"['Atsushi Higuchi', 'William CC Lima']"
76154099,Group quantization of parametrized systems. II. Pasting Hilbert spaces,12,1995,https://scholar.google.com/citations?view_op=view_citation&hl=en&user=iV38Wo0AAAAJ&cstart=20&pagesize=80&citation_for_view=iV38Wo0AAAAJ:7PzlFSSx8tAC,Atsushi Higuchi,1995/9/1,Journal of Mathematical Physics,,,"['P Hájíček', 'A Higuchi', 'J Tolar']",P Hájíček,"['A Higuchi', 'J Tolar']"
27866670,Gravitational waves emitted by a particle rotating around a Schwarzschild black hole: A semiclassical approach,11,2017,https://scholar.google.com/citations?view_op=view_citation&hl=en&user=iV38Wo0AAAAJ&cstart=20&pagesize=80&citation_for_view=iV38Wo0AAAAJ:ILKRHgRFtOwC,Atsushi Higuchi,2017/3/24,Physical Review D,,,"['Rafael P Bernar', 'Luis CB Crispino', 'Atsushi Higuchi']",Rafael P Bernar,"['Luis CB Crispino', 'Atsushi Higuchi']"
94548489,Photon structure functions and azimuthal asymmetries in two-photon processes,10,1981,https://scholar.google.com/citations?view_op=view_citation&hl=en&user=iV38Wo0AAAAJ&cstart=20&pagesize=80&citation_for_view=iV38Wo0AAAAJ:CHSYGLWDkRkC,Atsushi Higuchi,1981/9/1,Physical Review D,,,"['Atsushi Higuchi', 'Satoshi Matsuda', 'Jiro Kodaira']",Atsushi Higuchi,"['Satoshi Matsuda', 'Jiro Kodaira']"
21022318,"Entanglement of the vacuum between left, right, future, and past: Dirac spinor in Rindler and Kasner spaces",9,2021,https://scholar.google.com/citations?view_op=view_citation&hl=en&user=iV38Wo0AAAAJ&cstart=20&pagesize=80&citation_for_view=iV38Wo0AAAAJ:fbc8zXXH2BUC,Atsushi Higuchi,2021/6/8,Physical Review D,,,"['Kazushige Ueda', 'Atsushi Higuchi', 'Kazuhiro Yamamoto', 'Ar Rohim', 'Yue Nan']",Kazushige Ueda,"['Atsushi Higuchi', 'Kazuhiro Yamamoto', 'Ar Rohim', 'Yue Nan']"
62950132,Classical and quantum initial value problems for models of chronology violation,9,1996,https://scholar.google.com/citations?view_op=view_citation&hl=en&user=iV38Wo0AAAAJ&cstart=20&pagesize=80&citation_for_view=iV38Wo0AAAAJ:_Qo2XoVZTnwC,Atsushi Higuchi,1996/9/15,Physical Review D,,,"['CJ Fewster', 'A Higuchi', 'CG Wells']",CJ Fewster,"['A Higuchi', 'CG Wells']"
11626045,Gibbons-Hawking radiation of gravitons in the Poincaré and static patches of de Sitter spacetime,6,2018,https://scholar.google.com/citations?view_op=view_citation&hl=en&user=iV38Wo0AAAAJ&cstart=20&pagesize=80&citation_for_view=iV38Wo0AAAAJ:foquWX3nUaYC,Atsushi Higuchi,2018/4/4,Physical Review D,,,"['Rafael P Bernar', 'Luís CB Crispino', 'Atsushi Higuchi']",Rafael P Bernar,"['Luís CB Crispino', 'Atsushi Higuchi']"
27515151,Scalar radiation from a radially infalling source into a Schwarzschild black hole in the framework of quantum field theory,6,2018,https://scholar.google.com/citations?view_op=view_citation&hl=en&user=iV38Wo0AAAAJ&cstart=20&pagesize=80&citation_for_view=iV38Wo0AAAAJ:P7Ujq4OLJYoC,Atsushi Higuchi,2018/2/1,The European Physical Journal C,,,"['Leandro A Oliveira', 'Luís CB Crispino', 'Atsushi Higuchi']",Leandro A Oliveira,"['Luís CB Crispino', 'Atsushi Higuchi']"
3974465,Gauge symmetry breakdown at the horizon of extreme black holes,6,1995,https://scholar.google.com/citations?view_op=view_citation&hl=en&user=iV38Wo0AAAAJ&cstart=20&pagesize=80&citation_for_view=iV38Wo0AAAAJ:TFP_iSt0sucC,Atsushi Higuchi,1995/2/1,Classical and Quantum Gravity,,,"['J Bicak', 'C Cris', 'P Hajicek', 'A Higuchi']",J Bicak,"['C Cris', 'P Hajicek', 'A Higuchi']"
52519535,State vectors in higher-dimensional gravity with kinematic quantum numbers of quarks and leptons,6,1990,https://scholar.google.com/citations?view_op=view_citation&hl=en&user=iV38Wo0AAAAJ&cstart=20&pagesize=80&citation_for_view=iV38Wo0AAAAJ:RHpTSmoSYBkC,Atsushi Higuchi,1990/7/30,Nuclear Physics B,,,"['John L Friedman', 'Atsushi Higuchi']",John L Friedman,['Atsushi Higuchi']
84772057,Graviton two-point function in  static de Sitter spacetime,5,2016,https://scholar.google.com/citations?view_op=view_citation&hl=en&user=iV38Wo0AAAAJ&cstart=20&pagesize=80&citation_for_view=iV38Wo0AAAAJ:0KyAp5RtaNEC,Atsushi Higuchi,2016/8/3,International Journal of Modern Physics D,,,"['Rafael P Bernar', 'Luís CB Crispino', 'Atsushi Higuchi']",Rafael P Bernar,"['Luís CB Crispino', 'Atsushi Higuchi']"
64358031,Is the equivalence for the response of static scalar sources in the Schwarzschild and Rindler spacetimes valid only in four dimensions?,5,2004,https://scholar.google.com/citations?view_op=view_citation&hl=en&user=iV38Wo0AAAAJ&cstart=20&pagesize=80&citation_for_view=iV38Wo0AAAAJ:ns9cj8rnVeAC,Atsushi Higuchi,2004/12/17,Physical Review D,,,"['Luis CB Crispino', 'Atsushi Higuchi', 'George EA Matsas']",Luis CB Crispino,"['Atsushi Higuchi', 'George EA Matsas']"
60099931,Possible constraints on string theory in closed space with symmetries,5,2000,https://scholar.google.com/citations?view_op=view_citation&hl=en&user=iV38Wo0AAAAJ&cstart=20&pagesize=80&citation_for_view=iV38Wo0AAAAJ:3s1wT3WcHBgC,Atsushi Higuchi,2000/9/24,,,,['Atsushi Higuchi'],Atsushi Higuchi,
36144829,Removing the Faddeev-Popov zero modes from Yang-Mills theory in spacetimes with compact spatial sections,4,2015,https://scholar.google.com/citations?view_op=view_citation&hl=en&user=iV38Wo0AAAAJ&cstart=20&pagesize=80&citation_for_view=iV38Wo0AAAAJ:XiSMed-E-HIC,Atsushi Higuchi,2015/1/6,Physical Review D,,,"['Jos Gibbons', 'Atsushi Higuchi']",Jos Gibbons,['Atsushi Higuchi']
88120081,Quantum fields of nonzero spin in de Sitter spacetime,4,1987,https://scholar.google.com/citations?view_op=view_citation&hl=en&user=iV38Wo0AAAAJ&cstart=20&pagesize=80&citation_for_view=iV38Wo0AAAAJ:NMxIlDl6LWMC,Atsushi Higuchi,1987/1/1,,,,['Atsushi Higuchi'],Atsushi Higuchi,
35374871,"Scalar field in AdS2 and representations of SL (2, R)",3,2022,https://scholar.google.com/citations?view_op=view_citation&hl=en&user=iV38Wo0AAAAJ&cstart=20&pagesize=80&citation_for_view=iV38Wo0AAAAJ:nVrZBo8bIpAC,Atsushi Higuchi,2022/12/1,Journal of Mathematical Physics,,,"['Atsushi Higuchi', 'Lasse Schmieding', 'David Serrano Blanco']",Atsushi Higuchi,"['Lasse Schmieding', 'David Serrano Blanco']"
75365684,Equivalence between the in-in perturbation theories for quantum fields in Minkowski spacetime and in the Rindler wedge,3,2020,https://scholar.google.com/citations?view_op=view_citation&hl=en&user=iV38Wo0AAAAJ&cstart=20&pagesize=80&citation_for_view=iV38Wo0AAAAJ:nZcligLrVowC,Atsushi Higuchi,2020/3/17,Physical Review D,,,"['Atsushi Higuchi', 'William CC Lima']",Atsushi Higuchi,['William CC Lima']
58723620,Circular geodesic radiation in Schwarzschild spacetime: A semiclassical approach,3,2018,https://scholar.google.com/citations?view_op=view_citation&hl=en&user=iV38Wo0AAAAJ&cstart=20&pagesize=80&citation_for_view=iV38Wo0AAAAJ:ruyezt5ZtCIC,Atsushi Higuchi,2018/8/21,International Journal of Modern Physics D,,,"['Rafael P Bernar', 'Luis CB Crispino', 'Atsushi Higuchi']",Rafael P Bernar,"['Luis CB Crispino', 'Atsushi Higuchi']"
68577469,Influence of boundary conditions on the radiation emitted by an accelerated source,3,2010,https://scholar.google.com/citations?view_op=view_citation&hl=en&user=iV38Wo0AAAAJ&cstart=20&pagesize=80&citation_for_view=iV38Wo0AAAAJ:vV6vV6tmYwMC,Atsushi Higuchi,2010/3/1,Physical review d,,,"['Danilo T Alves', 'Luis CB Crispino', 'Marcelo C de Lima', 'Atsushi Higuchi']",Danilo T Alves,"['Luis CB Crispino', 'Marcelo C de Lima', 'Atsushi Higuchi']"
12089563,Radiation reaction in quantum mechanics,3,1998,https://scholar.google.com/citations?view_op=view_citation&hl=en&user=iV38Wo0AAAAJ&cstart=20&pagesize=80&citation_for_view=iV38Wo0AAAAJ:JV2RwH3_ST0C,Atsushi Higuchi,1998/12/15,arXiv preprint quant-ph/9812036,,,['Atsushi Higuchi'],Atsushi Higuchi,
94356991,Automorphic scalar fields in two-dimensional de Sitter space,2,2022,https://scholar.google.com/citations?view_op=view_citation&hl=en&user=iV38Wo0AAAAJ&cstart=20&pagesize=80&citation_for_view=iV38Wo0AAAAJ:artPoR2Yc-kC,Atsushi Higuchi,2022/12/13,Classical and Quantum Gravity,,,"['Atsushi Higuchi', 'Lasse Schmieding', 'David Serrano Blanco']",Atsushi Higuchi,"['Lasse Schmieding', 'David Serrano Blanco']"
94085086,Infrared problem in the Faddeev-Popov ghost propagator in perturbative quantum gravity in de Sitter spacetime,2,2021,https://scholar.google.com/citations?view_op=view_citation&hl=en&user=iV38Wo0AAAAJ&cstart=20&pagesize=80&citation_for_view=iV38Wo0AAAAJ:u-coK7KVo8oC,Atsushi Higuchi,2021/3/29,Physical Review D,,,"['Jos Gibbons', 'Atsushi Higuchi', 'William CC Lima']",Jos Gibbons,"['Atsushi Higuchi', 'William CC Lima']"
81902821,"Self-Adjoint extensions of the one-dimensional Schr\"" odinger operator with symmetric potential",2,2020,https://scholar.google.com/citations?view_op=view_citation&hl=en&user=iV38Wo0AAAAJ&cstart=20&pagesize=80&citation_for_view=iV38Wo0AAAAJ:GFxP56DSvIMC,Atsushi Higuchi,2020/5/21,arXiv preprint arXiv:2005.10774,,,"['Atsushi Higuchi', 'David Serrano Blanco']",Atsushi Higuchi,['David Serrano Blanco']
84418887,Bremsstrahlung by static charges outside a static black hole?,2,1996,https://scholar.google.com/citations?view_op=view_citation&hl=en&user=iV38Wo0AAAAJ&cstart=100&pagesize=100&citation_for_view=iV38Wo0AAAAJ:O3NaXMp0MMsC,Atsushi Higuchi,1996/5/16,arXiv preprint gr-qc/9605030,,,"['GE Matsas', 'Daniel Sudarsky', 'Atsushi Higuchi']",GE Matsas,"['Daniel Sudarsky', 'Atsushi Higuchi']"
37314151,The Schwinger model on a circle with an unconventional boundary condition,2,1991,https://scholar.google.com/citations?view_op=view_citation&hl=en&user=iV38Wo0AAAAJ&cstart=100&pagesize=100&citation_for_view=iV38Wo0AAAAJ:M3NEmzRMIkIC,Atsushi Higuchi,1991/1/17,Physics Letters B,,,['Atsushi Higuchi'],Atsushi Higuchi,
89131820,Symmetric tensor fields in de Sitter spacetime,2,1985,https://scholar.google.com/citations?view_op=view_citation&hl=en&user=iV38Wo0AAAAJ&cstart=100&pagesize=100&citation_for_view=iV38Wo0AAAAJ:f2IySw72cVMC,Atsushi Higuchi,1985/11/15,,,,['A Higuchi'],A Higuchi,
32730542,"Comment on “The equivalence principle in the Schwarzschild geometry”[Am. J. Phys. 62, 1037 (1994)]",1,2020,https://scholar.google.com/citations?view_op=view_citation&hl=en&user=iV38Wo0AAAAJ&cstart=100&pagesize=100&citation_for_view=iV38Wo0AAAAJ:gKiMpY-AVTkC,Atsushi Higuchi,2020/10/1,American Journal of Physics,,,"['Rafael P Bernar', 'Luís CB Crispino', 'Atsushi Higuchi', 'Haroldo CD Lima Junior']",Rafael P Bernar,"['Luís CB Crispino', 'Atsushi Higuchi', 'Haroldo CD Lima Junior']"
49015572,Supergravity on a three-torus: quantum linearization instabilities with a supergroup,1,2020,https://scholar.google.com/citations?view_op=view_citation&hl=en&user=iV38Wo0AAAAJ&cstart=100&pagesize=100&citation_for_view=iV38Wo0AAAAJ:OP4eGU-M3BUC,Atsushi Higuchi,2020/7/28,Classical and Quantum Gravity,,,"['Atsushi Higuchi', 'Lasse Schmieding']",Atsushi Higuchi,['Lasse Schmieding']
37391148,Linearized gravity in “closed” universes with continuous symmetries,1,1995,https://scholar.google.com/citations?view_op=view_citation&hl=en&user=iV38Wo0AAAAJ&cstart=100&pagesize=100&citation_for_view=iV38Wo0AAAAJ:pqnbT2bcN3wC,Atsushi Higuchi,1995/1/1,,,"Strings and Symmetries: Proceedings of the Gürsey Memorial Conference I Held at Istanbul, Turkey, 6–10 June 1994",['Atsushi Higuchi'],Atsushi Higuchi,
29609091,Gauge symmetry breaking by nontrivial boundary conditions,1,1991,https://scholar.google.com/citations?view_op=view_citation&hl=en&user=iV38Wo0AAAAJ&cstart=100&pagesize=100&citation_for_view=iV38Wo0AAAAJ:hMod-77fHWUC,Atsushi Higuchi,1991/5/15,Physical Review D,,,['Atsushi Higuchi'],Atsushi Higuchi,
6188437,On the new first order formalism of d= 11 supergravity,1,1985,https://scholar.google.com/citations?view_op=view_citation&hl=en&user=iV38Wo0AAAAJ&cstart=100&pagesize=100&citation_for_view=iV38Wo0AAAAJ:F9fV5C73w3QC,Atsushi Higuchi,1985/3/1,,,,['A Higuchi'],A Higuchi,
16851512,Comment on azimuthal dependence in leptoproduction,1,1982,https://scholar.google.com/citations?view_op=view_citation&hl=en&user=iV38Wo0AAAAJ&cstart=100&pagesize=100&citation_for_view=iV38Wo0AAAAJ:P5F9QuxV20EC,Atsushi Higuchi,1982/1/14,Physics Letters B,,,['Atsushi Higuchi'],Atsushi Higuchi,
39563514,Hartle-Hawking state in the real-time formalism,,2022,https://scholar.google.com/citations?view_op=view_citation&hl=en&user=iV38Wo0AAAAJ&cstart=100&pagesize=100&citation_for_view=iV38Wo0AAAAJ:5MTHONV0fEkC,Atsushi Higuchi,2022/2/7,Physical Review D,,,"['Atsushi Higuchi', 'William CC Lima']",Atsushi Higuchi,['William CC Lima']
11630069,Equivalence principle in Reissner–Nordström geometry,,2021,https://scholar.google.com/citations?view_op=view_citation&hl=en&user=iV38Wo0AAAAJ&cstart=100&pagesize=100&citation_for_view=iV38Wo0AAAAJ:5icHVeHT4IsC,Atsushi Higuchi,2021/11/1,Annals of Physics,,,"['Rafael P Bernar', 'Luis CB Crispino', 'Haroldo CD Lima Junior', 'Atsushi Higuchi']",Rafael P Bernar,"['Luis CB Crispino', 'Haroldo CD Lima Junior', 'Atsushi Higuchi']"
75807876,Amazonia in the route of General Relativity Preface,,2020,https://scholar.google.com/citations?view_op=view_citation&hl=en&user=iV38Wo0AAAAJ&cstart=100&pagesize=100&citation_for_view=iV38Wo0AAAAJ:lvd772isFD0C,Atsushi Higuchi,2020/8/1,,INTERNATIONAL JOURNAL OF MODERN PHYSICS D,,"['Luis CB Crispin', 'Sam R Dolan', 'Jose A Font', 'Carlos AR Herdeiro', 'Atsushi Higuchi']",Luis CB Crispin,"['Sam R Dolan', 'Jose A Font', 'Carlos AR Herdeiro', 'Atsushi Higuchi']"
56123125,Quantum gravitational perturbations in static de Sitter space: Infrared-finite two-point function,,2018,https://scholar.google.com/citations?view_op=view_citation&hl=en&user=iV38Wo0AAAAJ&cstart=100&pagesize=100&citation_for_view=iV38Wo0AAAAJ:oNZyr7d5Mn4C,Atsushi Higuchi,2018/1/1,,,,"['Rafael P Bernar', 'Luís CB Crispino', 'Atsushi Higuchi']",Rafael P Bernar,"['Luís CB Crispino', 'Atsushi Higuchi']"
7745743,"Entanglement of the vacuum between left, right, future, and past",,2017,https://scholar.google.com/citations?view_op=view_citation&hl=en&user=iV38Wo0AAAAJ&cstart=100&pagesize=100&citation_for_view=iV38Wo0AAAAJ:Aul-kAQHnToC,Atsushi Higuchi,2017/1/1,,,"27th Workshop on General Relativity and Gravitation in Japan, JGRG 2017","['Kazushige Ueda', 'Atsushi Higuchi', 'Satoshi Iso', 'Kazuhiro Yamamoto', 'Rumi Tatsukawa']",Kazushige Ueda,"['Atsushi Higuchi', 'Satoshi Iso', 'Kazuhiro Yamamoto', 'Rumi Tatsukawa']"
62241358,Bosonic Absorption by REISSNER-NORDSTRÖM Black Holes,,2015,https://scholar.google.com/citations?view_op=view_citation&hl=en&user=iV38Wo0AAAAJ&cstart=100&pagesize=100&citation_for_view=iV38Wo0AAAAJ:NhqRSupF_l8C,Atsushi Higuchi,2015/1/1,,,,"['LCB Crispino', 'ES Oliveira', 'A Higuchi']",LCB Crispino,"['ES Oliveira', 'A Higuchi']"
9306568,Section shock-absorbing black holes Reissner-Nordstroem for gravitational waves; Secao de choque de absorcao de buracos negros de Reissner-Nordstroem para ondas gravitacionais,,2012,https://scholar.google.com/citations?view_op=view_citation&hl=en&user=iV38Wo0AAAAJ&cstart=100&pagesize=100&citation_for_view=iV38Wo0AAAAJ:yqoGN6RLRZoC,Atsushi Higuchi,2012/7/1,,,,"['Ednilton S Oliveira', 'Luis CB Crispino', 'Atsushi Higuchi']",Ednilton S Oliveira,"['Luis CB Crispino', 'Atsushi Higuchi']"
61677238,Conversion of electromagnetic to gravitational waves in the Reissner-Nordstroem spacetime,,2011,https://scholar.google.com/citations?view_op=view_citation&hl=en&user=iV38Wo0AAAAJ&cstart=100&pagesize=100&citation_for_view=iV38Wo0AAAAJ:ldfaerwXgEUC,Atsushi Higuchi,2011/7/1,,,,"['Luis CB Crispino', 'Ednilton S Oliveira', 'Atsushi Higuchi']",Luis CB Crispino,"['Ednilton S Oliveira', 'Atsushi Higuchi']"
24587207,Electromagnetic absorption cross section for Schwarzschild black holes,,2008,https://scholar.google.com/citations?view_op=view_citation&hl=en&user=iV38Wo0AAAAJ&cstart=100&pagesize=100&citation_for_view=iV38Wo0AAAAJ:_OXeSy2IsFwC,Atsushi Higuchi,2008/7/1,,,,"['Ednilton Santos de Oliveira', 'Luis Carlos Bassalo Crispino', 'George Emanuel Avraam Matsas', 'Atsushi Higuchi']",Ednilton Santos de Oliveira,"['Luis Carlos Bassalo Crispino', 'George Emanuel Avraam Matsas', 'Atsushi Higuchi']"
22421145,Absorption Cross Sections of Low Energy Photons for the Schwarzschild and Extreme REISSNER-NORDSTRÖM Black Holes in Arbitrary Dimensions Higher than Three,,2005,https://scholar.google.com/citations?view_op=view_citation&hl=en&user=iV38Wo0AAAAJ&cstart=100&pagesize=100&citation_for_view=iV38Wo0AAAAJ:J_g5lzvAfSwC,Atsushi Higuchi,2005/1/1,,,,"['Luís CB Crispino', 'Atsushi Higuchi', 'George EA Matsas']",Luís CB Crispino,"['Atsushi Higuchi', 'George EA Matsas']"
97579984,"Interdisciplinary Physics: Biological Physics, Quantum Information, etc.-One-Qubit Reduced States of a Pure Many-Qubit State: Polygon Inequalities",,2003,https://scholar.google.com/citations?view_op=view_citation&hl=en&user=iV38Wo0AAAAJ&cstart=100&pagesize=100&citation_for_view=iV38Wo0AAAAJ:4vMrXwiscB8C,Atsushi Higuchi,2003/1/1,Physical Review Letters,,,"['A Higuchi', 'A Sudbery', 'J Szulc']",A Higuchi,"['A Sudbery', 'J Szulc']"
25772223,Radiation Emitted from a Scalar Source Rotating around a Black Hole,,2002,https://scholar.google.com/citations?view_op=view_citation&hl=en&user=iV38Wo0AAAAJ&cstart=100&pagesize=100&citation_for_view=iV38Wo0AAAAJ:ZHo1McVdvXMC,Atsushi Higuchi,2002/1/1,,,,"['Luís CB Crispino', 'Atsushi Higuchi', 'George EA Matsas']",Luís CB Crispino,"['Atsushi Higuchi', 'George EA Matsas']"
90409104,Radiation emitted from a swirling source around a black hole in quantum field theory in curved spacetime,,1999,https://scholar.google.com/citations?view_op=view_citation&hl=en&user=iV38Wo0AAAAJ&cstart=100&pagesize=100&citation_for_view=iV38Wo0AAAAJ:pyW8ca7W8N0C,Atsushi Higuchi,1999/1/6,arXiv preprint gr-qc/9901006,,,"['Luıs CB Crispino', 'Atsushi Higuchi', 'George EA Matsas']",Luıs CB Crispino,"['Atsushi Higuchi', 'George EA Matsas']"
68373214,Radiation by Static Sources Outside Static Black Hole?,,1999,https://scholar.google.com/citations?view_op=view_citation&hl=en&user=iV38Wo0AAAAJ&cstart=100&pagesize=100&citation_for_view=iV38Wo0AAAAJ:HoB7MX3m0LUC,Atsushi Higuchi,1999/1/1,"Recent Developments in Theoretical and Experimental General Relativity, Gravitation, and Relativistic Field Theories",,,"['Atsushi Higuchi', 'George EA Matsas', 'Daniel Sudarsky']",Atsushi Higuchi,"['George EA Matsas', 'Daniel Sudarsky']"
13551780,Interaction of static classical source with Hawking radiation in Schwarzschild spacetime,,1996,https://scholar.google.com/citations?view_op=view_citation&hl=en&user=iV38Wo0AAAAJ&cstart=100&pagesize=100&citation_for_view=iV38Wo0AAAAJ:yD5IFk8b50cC,Atsushi Higuchi,1996/9/10,arXiv preprint gr-qc/9609025,,,"['Atsushi Higuchi', 'George EA Matsas', 'Daniel Sudarsky']",Atsushi Higuchi,"['George EA Matsas', 'Daniel Sudarsky']"
1141783,Quantum Linearization Instabilities of de Sitter Spacetime,,1993,https://scholar.google.com/citations?view_op=view_citation&hl=en&user=iV38Wo0AAAAJ&cstart=100&pagesize=100&citation_for_view=iV38Wo0AAAAJ:tH6gc1N1XXoC,Atsushi Higuchi,1993/1/1,"Directions in General Relativity: Papers in Honor of Dieter Brill, Volume 2",,,['Atsushi Higuchi'],Atsushi Higuchi,
88302014,Quantum soliton in QED in S sup 1 times R sup 2 spacetime,,1990,https://scholar.google.com/citations?view_op=view_citation&hl=en&user=iV38Wo0AAAAJ&cstart=100&pagesize=100&citation_for_view=iV38Wo0AAAAJ:IRz6iEL74y4C,Atsushi Higuchi,1990/6/10,International Journal of Modern Physics A;(USA),,,"['A Higuchi', 'L Parker']",A Higuchi,['L Parker']
99762709,QUANTUM SOLITON IN QED IN S 1× R 2 SPACETIME,,1990,https://scholar.google.com/citations?view_op=view_citation&hl=en&user=iV38Wo0AAAAJ&cstart=100&pagesize=100&citation_for_view=iV38Wo0AAAAJ:u_35RYKgDlwC,Atsushi Higuchi,1990/1/1,International Journal of Modern Physics A,,,"['Atsushi Higuchi', 'Leonard Parker']",Atsushi Higuchi,['Leonard Parker']
2396418,Aspects of QED and non-Abelian gauge theories in S/sup 1/not=/sup 3/and S/sup 1/not=/sup 4/spacetimes,,1988,https://scholar.google.com/citations?view_op=view_citation&hl=en&user=iV38Wo0AAAAJ&cstart=100&pagesize=100&citation_for_view=iV38Wo0AAAAJ:QYdC8u9Cj1oC,Atsushi Higuchi,1988/5/15,Phys. Rev. D;(United States),,,"['A Higuchi', 'L Parker']",A Higuchi,['L Parker']
14947787,"ON THE SPONTANEOUS BREAKING OF SUPERSYMMETRY (Dynamical Symmetry and Supersymmetry in Nuclear, Particle, and Atomic-Molecular Physics)",,1983,https://scholar.google.com/citations?view_op=view_citation&hl=en&user=iV38Wo0AAAAJ&cstart=100&pagesize=100&citation_for_view=iV38Wo0AAAAJ:2P1L_qKh6hAC,Atsushi Higuchi,1983/3/20,Soryushiron Kenkyu Electronics,,,['Atsushi Higuchi'],Atsushi Higuchi,
86556007,Study on quantum entanglement in the Minkowski vacuum of field,,,https://scholar.google.com/citations?view_op=view_citation&hl=en&user=iV38Wo0AAAAJ&cstart=100&pagesize=100&citation_for_view=iV38Wo0AAAAJ:gVv57TyPmFsC,Atsushi Higuchi,nan/1/1,IEICE Technical Report; IEICE Tech. Rep.,,,"['Kazushige Ueda', 'Atsushi Higuchi', 'Satoshi Iso', 'Kazuhiro Yamamoto', 'Rumi Tatsukawa']",Kazushige Ueda,"['Atsushi Higuchi', 'Satoshi Iso', 'Kazuhiro Yamamoto', 'Rumi Tatsukawa']"
56077800,Traces of the Fulling-Davies-Unruh thermal bath in classical field theory,,,https://scholar.google.com/citations?view_op=view_citation&hl=en&user=iV38Wo0AAAAJ&cstart=100&pagesize=100&citation_for_view=iV38Wo0AAAAJ:b1wdh0AR-JQC,Atsushi Higuchi,nan/1/1,PARTICLES,,,"['Atsushi Higuchi', 'George EA Matsas']",Atsushi Higuchi,['George EA Matsas']
35818376,Graviton two-point function inside the cosmological horizon of de Sitter spacetime,,,https://scholar.google.com/citations?view_op=view_citation&hl=en&user=iV38Wo0AAAAJ&cstart=100&pagesize=100&citation_for_view=iV38Wo0AAAAJ:tYavs44e6CUC,Atsushi Higuchi,nan/1/1,,,,"['Rafael Pinto Bernar', 'Luís Carlos Bassalo Crispino', 'Atsushi Higuchi']",Rafael Pinto Bernar,"['Luís Carlos Bassalo Crispino', 'Atsushi Higuchi']"
80541301,Section shock-absorbing black holes Reissner-Nordstroem for gravitational waves,,,https://scholar.google.com/citations?view_op=view_citation&hl=en&user=iV38Wo0AAAAJ&cstart=100&pagesize=100&citation_for_view=iV38Wo0AAAAJ:evX43VCCuoAC,Atsushi Higuchi,nan/1/1,,,,"['Ednilton S Oliveira', 'Luis CB Crispino', 'Atsushi Higuchi']",Ednilton S Oliveira,"['Luis CB Crispino', 'Atsushi Higuchi']"
