PaperID,Title,Citations,Year,Paper url,Google Scholar profile name,Publication date,Journal,Source,Conference,Authors,Primary author,Supporting authors
99570517,Fluid mixing by curved trajectories of microswimmers,78,2013,https://scholar.google.com/citations?view_op=view_citation&hl=en&user=5Oe8mLgAAAAJ&citation_for_view=5Oe8mLgAAAAJ:HE397vMXCloC,Dmitri (Mitya) Pushkin,2013/10/31,Physical review letters,,,"['Dmitri O Pushkin', 'Julia M Yeomans']",Dmitri O Pushkin,['Julia M Yeomans']
60752457,An introduction to the hydrodynamics of swimming microorganisms,77,2014,https://scholar.google.com/citations?view_op=view_citation&hl=en&user=5Oe8mLgAAAAJ&citation_for_view=5Oe8mLgAAAAJ:D_sINldO8mEC,Dmitri (Mitya) Pushkin,2014/9/1,,The European Physical Journal Special Topics,,"['Julia M Yeomans', 'Dmitri O Pushkin', 'Henry Shum']",Julia M Yeomans,"['Dmitri O Pushkin', 'Henry Shum']"
1511236,Ordering of small particles in one-dimensional coherent structures by time-periodic flows,74,2011,https://scholar.google.com/citations?view_op=view_citation&hl=en&user=5Oe8mLgAAAAJ&citation_for_view=5Oe8mLgAAAAJ:9vf0nzSNQJEC,Dmitri (Mitya) Pushkin,2011/6/10,Physical review letters,,,"['Dmitri O Pushkin', 'Denis E Melnikov', 'Valentina M Shevtsova']",Dmitri O Pushkin,"['Denis E Melnikov', 'Valentina M Shevtsova']"
66332620,Entrainment dominates the interaction of microalgae with micron-sized objects,73,2016,https://scholar.google.com/citations?view_op=view_citation&hl=en&user=5Oe8mLgAAAAJ&citation_for_view=5Oe8mLgAAAAJ:eMMeJKvmdy0C,Dmitri (Mitya) Pushkin,2016/8/18,Nature communications,,,"['Raphaël Jeanneret', 'Dmitri O Pushkin', 'Vasily Kantsler', 'Marco Polin']",Raphaël Jeanneret,"['Dmitri O Pushkin', 'Vasily Kantsler', 'Marco Polin']"
73870747,Fluid transport by individual microswimmers,71,2013,https://scholar.google.com/citations?view_op=view_citation&hl=en&user=5Oe8mLgAAAAJ&citation_for_view=5Oe8mLgAAAAJ:XiVPGOgt02cC,Dmitri (Mitya) Pushkin,2013/7/1,Journal of Fluid Mechanics,,,"['Dmitri O Pushkin', 'Henry Shum', 'Julia M Yeomans']",Dmitri O Pushkin,"['Henry Shum', 'Julia M Yeomans']"
97464634,Tracer trajectories and displacement due to a micro-swimmer near a surface,54,2015,https://scholar.google.com/citations?view_op=view_citation&hl=en&user=5Oe8mLgAAAAJ&citation_for_view=5Oe8mLgAAAAJ:VOx2b1Wkg3QC,Dmitri (Mitya) Pushkin,2015/6/1,Journal of Fluid Mechanics,,,"['Arnold JTM Mathijssen', 'Dmitri O Pushkin', 'Julia M Yeomans']",Arnold JTM Mathijssen,"['Dmitri O Pushkin', 'Julia M Yeomans']"
28093257,Accumulation of particles in time-dependent thermocapillary flow in a liquid bridge. Modeling of experiments,41,2011,https://scholar.google.com/citations?view_op=view_citation&hl=en&user=5Oe8mLgAAAAJ&citation_for_view=5Oe8mLgAAAAJ:J-pR_7NvFogC,Dmitri (Mitya) Pushkin,2011/2/1,The European Physical Journal Special Topics,,,"['Denis Melnikov', 'D Pushkin', 'Valentina Shevtsova']",Denis Melnikov,"['D Pushkin', 'Valentina Shevtsova']"
37308289,Bank mergers as scale-free coagulation,41,2004,https://scholar.google.com/citations?view_op=view_citation&hl=en&user=5Oe8mLgAAAAJ&citation_for_view=5Oe8mLgAAAAJ:5awf1xo2G04C,Dmitri (Mitya) Pushkin,2004/5/15,Physica A: Statistical Mechanics and its Applications,,,"['Dmitri O Pushkin', 'Hassan Aref']",Dmitri O Pushkin,['Hassan Aref']
67915490,The JEREMI-Project on thermocapillary convection in liquid bridges. Part A: Overview of Particle Accumulation Structures,39,2014,https://scholar.google.com/citations?view_op=view_citation&hl=en&user=5Oe8mLgAAAAJ&citation_for_view=5Oe8mLgAAAAJ:ye4kPcJQO24C,Dmitri (Mitya) Pushkin,2014/3/15,,Fluid Dynamics and Materials Processing,,"['HC Kuhlmann', 'M Lappa', 'Denis Melnikov', 'Roman Mukin', 'FH Muldoon', 'D Pushkin', 'V Shevtsova', 'I Ueno']",HC Kuhlmann,"['M Lappa', 'Denis Melnikov', 'Roman Mukin', 'FH Muldoon', 'D Pushkin', 'V Shevtsova', 'I Ueno']"
60345813,Synchronization of finite-size particles by a traveling wave in a cylindrical flow,39,2013,https://scholar.google.com/citations?view_op=view_citation&hl=en&user=5Oe8mLgAAAAJ&citation_for_view=5Oe8mLgAAAAJ:PELIpwtuRlgC,Dmitri (Mitya) Pushkin,2013/9/1,Physics of fluids,,,"['Denis E Melnikov', 'Dmitri O Pushkin', 'Valentina M Shevtsova']",Denis E Melnikov,"['Dmitri O Pushkin', 'Valentina M Shevtsova']"
15224011,Stirring by swimmers in confined microenvironments,30,2014,https://scholar.google.com/citations?view_op=view_citation&hl=en&user=5Oe8mLgAAAAJ&citation_for_view=5Oe8mLgAAAAJ:WqliGbK-hY8C,Dmitri (Mitya) Pushkin,2014/4/25,Journal of Statistical Mechanics: Theory and Experiment,,,"['Dmitri O Pushkin', 'Julia M Yeomans']",Dmitri O Pushkin,['Julia M Yeomans']
49371572,Self-similarity theory of stationary coagulation,21,2002,https://scholar.google.com/citations?view_op=view_citation&hl=en&user=5Oe8mLgAAAAJ&citation_for_view=5Oe8mLgAAAAJ:1yQoGdGgb4wC,Dmitri (Mitya) Pushkin,2002/2/1,Physics of fluids,,,"['Dmitri O Pushkin', 'Hassan Aref']",Dmitri O Pushkin,['Hassan Aref']
2076025,Confinement enhances the diversity of microbial flow fields,17,2019,https://scholar.google.com/citations?view_op=view_citation&hl=en&user=5Oe8mLgAAAAJ&citation_for_view=5Oe8mLgAAAAJ:olpn-zPbct0C,Dmitri (Mitya) Pushkin,2019/12/13,Physical Review Letters,,,"['Raphaël Jeanneret', 'Dmitri O Pushkin', 'Marco Polin']",Raphaël Jeanneret,"['Dmitri O Pushkin', 'Marco Polin']"
38093393,Particle self-ordering in periodic flows,7,2011,https://scholar.google.com/citations?view_op=view_citation&hl=en&user=5Oe8mLgAAAAJ&citation_for_view=5Oe8mLgAAAAJ:_Re3VWB3Y0AC,Dmitri (Mitya) Pushkin,2011/1/1,Physical review letters,,,"['Dimitri Pushkin', 'Denis Melnikov', 'Valentina Shevtsova']",Dimitri Pushkin,"['Denis Melnikov', 'Valentina Shevtsova']"
1753061,A solvable model of axisymmetric and non-axisymmetric droplet bouncing,6,2017,https://scholar.google.com/citations?view_op=view_citation&hl=en&user=5Oe8mLgAAAAJ&citation_for_view=5Oe8mLgAAAAJ:PR6Y55bgFSsC,Dmitri (Mitya) Pushkin,2017/1/1,Soft Matter,,,"['Matthew Andrew', 'Julia M Yeomans', 'Dmitri O Pushkin']",Matthew Andrew,"['Julia M Yeomans', 'Dmitri O Pushkin']"
58684501,On synchronization of particles with the wave in thermocapillary oscillatory flows,5,2012,https://scholar.google.com/citations?view_op=view_citation&hl=en&user=5Oe8mLgAAAAJ&citation_for_view=5Oe8mLgAAAAJ:LjlpjdlvIbIC,Dmitri (Mitya) Pushkin,2012/4/30,Journal of The Japan Society of Microgravity Application,,,"['Denis Melnikov', 'Tomohiko Takakusagi', 'Dmitri PUSHKIN', 'Valentina Shevtsova']",Denis Melnikov,"['Tomohiko Takakusagi', 'Dmitri PUSHKIN', 'Valentina Shevtsova']"
78686024,Bugs on a Slippery Plane: Understanding the Motility of Microbial Pathogens with Mathematical Modelling,3,2016,https://scholar.google.com/citations?view_op=view_citation&hl=en&user=5Oe8mLgAAAAJ&citation_for_view=5Oe8mLgAAAAJ:eflP2zaiRacC,Dmitri (Mitya) Pushkin,2016/1/1,Biophysics of Infection,,,"['Dmitri O Pushkin', 'Martin A Bees']",Dmitri O Pushkin,['Martin A Bees']
72765848,"Response to “Comment on ‘Synchronization of finite-size particles by a traveling wave in a cylindrical flow”’[Phys. Fluids 26, 099101 (2014)]",3,2014,https://scholar.google.com/citations?view_op=view_citation&hl=en&user=5Oe8mLgAAAAJ&citation_for_view=5Oe8mLgAAAAJ:Mojj43d5GZwC,Dmitri (Mitya) Pushkin,2014/9/1,Physics of fluids,,,"['DE Melnikov', 'DO Pushkin', 'VM Shevtsova']",DE Melnikov,"['DO Pushkin', 'VM Shevtsova']"
6372025,Interfacial activity dynamics of confined active droplets,2,2023,https://scholar.google.com/citations?view_op=view_citation&hl=en&user=5Oe8mLgAAAAJ&citation_for_view=5Oe8mLgAAAAJ:W5xh706n7nkC,Dmitri (Mitya) Pushkin,2023/7/1,Journal of Fluid Mechanics,,,"['Prashanth Ramesh', 'Babak Vajdi Hokmabad', 'Dmitri O Pushkin', 'Arnold JTM Mathijssen', 'Corinna C Maass']",Prashanth Ramesh,"['Babak Vajdi Hokmabad', 'Dmitri O Pushkin', 'Arnold JTM Mathijssen', 'Corinna C Maass']"
53816264,"Pushkin, Melnikov, and Shevtsova Reply",2,2012,https://scholar.google.com/citations?view_op=view_citation&hl=en&user=5Oe8mLgAAAAJ&citation_for_view=5Oe8mLgAAAAJ:q3oQSFYPqjQC,Dmitri (Mitya) Pushkin,2012/6/13,Physical Review Letters,,,"['DO Pushkin', 'DE Melnikov', 'VM Shevtsova']",DO Pushkin,"['DE Melnikov', 'VM Shevtsova']"
68922807,Stochastic gel-shatter cycles in coalescence-fragmentation models,1,2021,https://scholar.google.com/citations?view_op=view_citation&hl=en&user=5Oe8mLgAAAAJ&cstart=20&pagesize=80&citation_for_view=5Oe8mLgAAAAJ:WA5NYHcadZ8C,Dmitri (Mitya) Pushkin,2021/5/10,Europhysics Letters,,,"['Brennen T Fagan', 'Niall J MacKay', 'Dmitri O Pushkin', 'A Jamie Wood']",Brennen T Fagan,"['Niall J MacKay', 'Dmitri O Pushkin', 'A Jamie Wood']"
2814229,Nonlinear Scale-Free Cascades and Their Stationary Spectra,1,2004,https://scholar.google.com/citations?view_op=view_citation&hl=en&user=5Oe8mLgAAAAJ&cstart=20&pagesize=80&citation_for_view=5Oe8mLgAAAAJ:SdhP9T11ey4C,Dmitri (Mitya) Pushkin,2004/1/1,arXiv preprint cond-mat/0407421,,,"['Dmitri O Pushkin', 'Hassan Aref']",Dmitri O Pushkin,['Hassan Aref']
36098737,Coagulation in particle-laden flows,1,1999,https://scholar.google.com/citations?view_op=view_citation&hl=en&user=5Oe8mLgAAAAJ&cstart=20&pagesize=80&citation_for_view=5Oe8mLgAAAAJ:VL0QpB8kHFEC,Dmitri (Mitya) Pushkin,1999/11/1,APS Division of Fluid Dynamics Meeting Abstracts,,,"['Dmitri Pushkin', 'Hassan Aref']",Dmitri Pushkin,['Hassan Aref']
84734890,Illuminating the spatio-temporal dynamics of lipopolysaccharide in the Gram-negative bacterial outer membrane,,2019,https://scholar.google.com/citations?view_op=view_citation&hl=en&user=5Oe8mLgAAAAJ&cstart=20&pagesize=80&citation_for_view=5Oe8mLgAAAAJ:ZfRJV9d4-WMC,Dmitri (Mitya) Pushkin,2019/7/1,,,EUROPEAN BIOPHYSICS JOURNAL WITH BIOPHYSICS LETTERS,"['R Leaman', 'S Lenton', 'L Mantion', 'M Fascione', 'D Pushkin', 'M Coles', 'C Baumann']",R Leaman,"['S Lenton', 'L Mantion', 'M Fascione', 'D Pushkin', 'M Coles', 'C Baumann']"
55740906,Topological sensitivity of microbial flow fields under tight confinement,,2019,https://scholar.google.com/citations?view_op=view_citation&hl=en&user=5Oe8mLgAAAAJ&cstart=20&pagesize=80&citation_for_view=5Oe8mLgAAAAJ:N5tVd3kTz84C,Dmitri (Mitya) Pushkin,2019/4/1,arXiv preprint arXiv:1904.08319,,,"['Raphaël Jeanneret', 'Dmitri O Pushkin', 'Marco Polin']",Raphaël Jeanneret,"['Dmitri O Pushkin', 'Marco Polin']"
37807193,Spatio-Temporal Dynamics and Turnover of Lipopolysaccharide in the Bacterial Outer Membrane,,2018,https://scholar.google.com/citations?view_op=view_citation&hl=en&user=5Oe8mLgAAAAJ&cstart=20&pagesize=80&citation_for_view=5Oe8mLgAAAAJ:tKAzc9rXhukC,Dmitri (Mitya) Pushkin,2018/2/2,Biophysical Journal,,,"['Sam Lenton', 'Rosalyn M Leaman', 'Richard J Spears', 'Martin A Fascione', 'Dmitri O Pushkin', 'Mark C Coles', 'Christoph G Baumann']",Sam Lenton,"['Rosalyn M Leaman', 'Richard J Spears', 'Martin A Fascione', 'Dmitri O Pushkin', 'Mark C Coles', 'Christoph G Baumann']"
33923570,Illuminating the spatio-temporal dynamics of lipopolysaccharide in the Gram-negative outer membrane,,2017,https://scholar.google.com/citations?view_op=view_citation&hl=en&user=5Oe8mLgAAAAJ&cstart=20&pagesize=80&citation_for_view=5Oe8mLgAAAAJ:7T2F9Uy0os0C,Dmitri (Mitya) Pushkin,2017/7/1,,,,"['Rosalyn Mary Leaman', 'Richard James Spears', 'Martin Anthony Fascione', 'Dmitri Pushkin', 'Mark Christopher Coles', 'Christoph George Baumann']",Rosalyn Mary Leaman,"['Richard James Spears', 'Martin Anthony Fascione', 'Dmitri Pushkin', 'Mark Christopher Coles', 'Christoph George Baumann']"
95945654,Illuminating the spatio-temporal dynamics of lipopolysaccharide in the bacterial outer membrane,,2017,https://scholar.google.com/citations?view_op=view_citation&hl=en&user=5Oe8mLgAAAAJ&cstart=20&pagesize=80&citation_for_view=5Oe8mLgAAAAJ:NJ774b8OgUMC,Dmitri (Mitya) Pushkin,2017/7/1,,,EUROPEAN BIOPHYSICS JOURNAL WITH BIOPHYSICS LETTERS,"['RM Leaman', 'RJ Spears', 'MA Fascione', 'DO Pushkin', 'MC Coles', 'CG Baumann']",RM Leaman,"['RJ Spears', 'MA Fascione', 'DO Pushkin', 'MC Coles', 'CG Baumann']"
51026872,Mixing in suspensions of active particles,,2014,https://scholar.google.com/citations?view_op=view_citation&hl=en&user=5Oe8mLgAAAAJ&cstart=20&pagesize=80&citation_for_view=5Oe8mLgAAAAJ:hkOj_22Ku90C,Dmitri (Mitya) Pushkin,2014/3/1,APS March Meeting Abstracts,,,"['Dmitri O Pushkin', 'Julia M Yeomans']",Dmitri O Pushkin,['Julia M Yeomans']
96198145,Mixing by curved trajectories of microswimmers,,2013,https://scholar.google.com/citations?view_op=view_citation&hl=en&user=5Oe8mLgAAAAJ&cstart=20&pagesize=80&citation_for_view=5Oe8mLgAAAAJ:_B80troHkn4C,Dmitri (Mitya) Pushkin,2013/11/1,APS Division of Fluid Dynamics Meeting Abstracts,,,"['Dmitri Pushkin', 'Julia Yeomans']",Dmitri Pushkin,['Julia Yeomans']
92105483,Mixing by individual swimmers,,2012,https://scholar.google.com/citations?view_op=view_citation&hl=en&user=5Oe8mLgAAAAJ&cstart=20&pagesize=80&citation_for_view=5Oe8mLgAAAAJ:eq2jaN3J8jMC,Dmitri (Mitya) Pushkin,2012/11/1,APS Division of Fluid Dynamics Meeting Abstracts,,,"['Dmitri Pushkin', 'Henry Shum', 'Julia Yeomans']",Dmitri Pushkin,"['Henry Shum', 'Julia Yeomans']"
24045207,Analysis of the orbits of particles generating one-dimensional dynamic coherent structures,,2012,https://scholar.google.com/citations?view_op=view_citation&hl=en&user=5Oe8mLgAAAAJ&cstart=20&pagesize=80&citation_for_view=5Oe8mLgAAAAJ:eJXPG6dFmWUC,Dmitri (Mitya) Pushkin,2012/11/1,APS Division of Fluid Dynamics Meeting Abstracts,,,"['Denis Melnikov', 'Dmitri Pushkin', 'Valentina Shevtsova', 'Jeremi Collaboration']",Denis Melnikov,"['Dmitri Pushkin', 'Valentina Shevtsova', 'Jeremi Collaboration']"
99590272,"Comment on"" Ordering of Small Particles in One-Dimensional Coherent Structures by Time-Periodic Flows"" Reply",,2012,https://scholar.google.com/citations?view_op=view_citation&hl=en&user=5Oe8mLgAAAAJ&cstart=20&pagesize=80&citation_for_view=5Oe8mLgAAAAJ:mvPsJ3kp5DgC,Dmitri (Mitya) Pushkin,2012/6/13,,PHYSICAL REVIEW LETTERS,,"['DO Pushkin', 'DE Melnikov', 'VM Shevtsova']",DO Pushkin,"['DE Melnikov', 'VM Shevtsova']"
35453283,Numerical evidence for formation of``resonant''coherent structures by an ensemble of small rigid particles in thermocapillary flows,,2011,https://scholar.google.com/citations?view_op=view_citation&hl=en&user=5Oe8mLgAAAAJ&cstart=20&pagesize=80&citation_for_view=5Oe8mLgAAAAJ:fQNAKQ3IYiAC,Dmitri (Mitya) Pushkin,2011/11/1,APS Division of Fluid Dynamics Meeting Abstracts,,,"['Denis Melnikov', 'Dmitri Pushkin', 'Valentina Shevtsova']",Denis Melnikov,"['Dmitri Pushkin', 'Valentina Shevtsova']"
58578136,Formation of dynamic coherent structures by an ensemble of rigid particles,,2010,https://scholar.google.com/citations?view_op=view_citation&hl=en&user=5Oe8mLgAAAAJ&cstart=20&pagesize=80&citation_for_view=5Oe8mLgAAAAJ:dTyEYWd-f8wC,Dmitri (Mitya) Pushkin,2010/11/1,APS Division of Fluid Dynamics Meeting Abstracts,,,"['Denis Melnikov', 'Dmitri Pushkin', 'Valentina Shevtsova']",Denis Melnikov,"['Dmitri Pushkin', 'Valentina Shevtsova']"
67302018,Self-ordering of microscopic particles in time-periodic flows,,2010,https://scholar.google.com/citations?view_op=view_citation&hl=en&user=5Oe8mLgAAAAJ&cstart=20&pagesize=80&citation_for_view=5Oe8mLgAAAAJ:tkaPQYYpVKoC,Dmitri (Mitya) Pushkin,2010/11/1,APS Division of Fluid Dynamics Meeting Abstracts,,,"['Dmitri Pushkin', 'Denis Melnikov', 'Valentina Shevtsova']",Dmitri Pushkin,"['Denis Melnikov', 'Valentina Shevtsova']"
57436778,Resonant'accumulation of small particles in large-scale fluid flows--a step in planet formation?,,2010,https://scholar.google.com/citations?view_op=view_citation&hl=en&user=5Oe8mLgAAAAJ&cstart=20&pagesize=80&citation_for_view=5Oe8mLgAAAAJ:t6usbXjVLHcC,Dmitri (Mitya) Pushkin,2010/1/1,38th COSPAR Scientific Assembly,,,"['Dmitri Pushkin', 'Denis Melnikov', 'Valentina Shevtsova']",Dmitri Pushkin,"['Denis Melnikov', 'Valentina Shevtsova']"
34594408,Segregation and ordering of particles in non-stationary flows,,2010,https://scholar.google.com/citations?view_op=view_citation&hl=en&user=5Oe8mLgAAAAJ&cstart=20&pagesize=80&citation_for_view=5Oe8mLgAAAAJ:1qzjygNMrQYC,Dmitri (Mitya) Pushkin,2010/1/1,38th COSPAR Scientific Assembly,,,"['Dmitri Pushkin', 'Denis Melnikov', 'Valentina Shevtsova']",Dmitri Pushkin,"['Denis Melnikov', 'Valentina Shevtsova']"
99908398,Dry fibrous floc formation,,2004,https://scholar.google.com/citations?view_op=view_citation&hl=en&user=5Oe8mLgAAAAJ&cstart=20&pagesize=80&citation_for_view=5Oe8mLgAAAAJ:AXPGKjj_ei8C,Dmitri (Mitya) Pushkin,2004/11/1,APS Division of Fluid Dynamics Meeting Abstracts,,,"['Eliot Fried', 'Amy Shen', 'Dmitri Pushkin', 'Hassan Aref']",Eliot Fried,"['Amy Shen', 'Dmitri Pushkin', 'Hassan Aref']"
81562342,Inhomogeneous cluster coagulation equation,,2004,https://scholar.google.com/citations?view_op=view_citation&hl=en&user=5Oe8mLgAAAAJ&cstart=20&pagesize=80&citation_for_view=5Oe8mLgAAAAJ:V3AGJWp-ZtQC,Dmitri (Mitya) Pushkin,2004/11/1,APS Division of Fluid Dynamics Meeting Abstracts,,,"['Dmitri Pushkin', 'Hassan Aref']",Dmitri Pushkin,['Hassan Aref']
67887927,Scale-free nonlinear conservative cascades and their stationary spectra,,2004,https://scholar.google.com/citations?view_op=view_citation&hl=en&user=5Oe8mLgAAAAJ&cstart=20&pagesize=80&citation_for_view=5Oe8mLgAAAAJ:5ugPr518TE4C,Dmitri (Mitya) Pushkin,2004/7/16,arXiv preprint cond-mat/0407421,,,"['Dmitri O Pushkin', 'Hassan Aref']",Dmitri O Pushkin,['Hassan Aref']
76769133,Size distribution in scale-free networks,,2002,https://scholar.google.com/citations?view_op=view_citation&hl=en&user=5Oe8mLgAAAAJ&cstart=20&pagesize=80&citation_for_view=5Oe8mLgAAAAJ:Y5dfb0dijaUC,Dmitri (Mitya) Pushkin,2002/3/1,APS March Meeting Abstracts,,,"['Dmitri Pushkin', 'Hassan Aref']",Dmitri Pushkin,['Hassan Aref']
50804029,Dry floc formation in a rotated fibrous granular medium,,2002,https://scholar.google.com/citations?view_op=view_citation&hl=en&user=5Oe8mLgAAAAJ&cstart=20&pagesize=80&citation_for_view=5Oe8mLgAAAAJ:BrmTIyaxlBUC,Dmitri (Mitya) Pushkin,2002/3/1,APS March Meeting Abstracts,,,"['Amy Shen', 'Eliot Fried', 'Dmitri Pushkin', 'Hassan Aref']",Amy Shen,"['Eliot Fried', 'Dmitri Pushkin', 'Hassan Aref']"
27978564,Floc formation in a fibrous granular medium flowing within a rotating cylinder,,2002,https://scholar.google.com/citations?view_op=view_citation&hl=en&user=5Oe8mLgAAAAJ&cstart=20&pagesize=80&citation_for_view=5Oe8mLgAAAAJ:LPZeul_q3PIC,Dmitri (Mitya) Pushkin,2002/3/1,APS March Meeting Abstracts,,,"['Eliot Fried', 'Amy Shen', 'Dmitri Pushkin', 'Hassan Aref']",Eliot Fried,"['Amy Shen', 'Dmitri Pushkin', 'Hassan Aref']"
44917707,Crossover behavior in a coagulating system,,2001,https://scholar.google.com/citations?view_op=view_citation&hl=en&user=5Oe8mLgAAAAJ&cstart=20&pagesize=80&citation_for_view=5Oe8mLgAAAAJ:kRWSkSYxWN8C,Dmitri (Mitya) Pushkin,2001/11/1,APS Division of Fluid Dynamics Meeting Abstracts,,,"['Dmitri O Pushkin', 'S Balachandar', 'Hassan Aref']",Dmitri O Pushkin,"['S Balachandar', 'Hassan Aref']"
38587142,Particle size distributions due to coagulation in particle-laden flows,,2000,https://scholar.google.com/citations?view_op=view_citation&hl=en&user=5Oe8mLgAAAAJ&cstart=20&pagesize=80&citation_for_view=5Oe8mLgAAAAJ:JoZmwDi-zQgC,Dmitri (Mitya) Pushkin,2000/11/1,APS Division of Fluid Dynamics Meeting Abstracts,,,"['Dmitri O Pushkin', 'S Balachandar', 'Hassan Aref']",Dmitri O Pushkin,"['S Balachandar', 'Hassan Aref']"
50437707,Self-Similar Theory of Stationary Coagulation,,2000,https://scholar.google.com/citations?view_op=view_citation&hl=en&user=5Oe8mLgAAAAJ&cstart=20&pagesize=80&citation_for_view=5Oe8mLgAAAAJ:ZuybSZzF8UAC,Dmitri (Mitya) Pushkin,2000/3/1,APS March Meeting Abstracts,,,"['Dmitri Pushkin', 'Hassan Aref']",Dmitri Pushkin,['Hassan Aref']
82602131,Bugs on a slippery plane,,,https://scholar.google.com/citations?view_op=view_citation&hl=en&user=5Oe8mLgAAAAJ&cstart=20&pagesize=80&citation_for_view=5Oe8mLgAAAAJ:tzM49s52ZIMC,Dmitri (Mitya) Pushkin,nan/1/1,,,,"['Dmitri O Pushkin', 'Martin A Bees']",Dmitri O Pushkin,['Martin A Bees']
