PaperID,Title,Citations,Year,Paper url,Google Scholar profile name,Publication date,Journal,Source,Conference,Authors,Primary author,Supporting authors
34170542,All mutually unbiased bases in dimensions two to five,120,2010,https://scholar.google.com/citations?view_op=view_citation&hl=en&user=tpPPHnMAAAAJ&citation_for_view=tpPPHnMAAAAJ:35N4QoGY0k4C,Stefan Weigert,2010/1/1,Quantum Information and Computation,,,"['Stephen Brierley', 'Stefan Weigert', 'Ingemar Bengtsson']",Stephen Brierley,"['Stefan Weigert', 'Ingemar Bengtsson']"
66484412,Constructing Mutually Unbiased Bases in Dimension Six,110,2009,https://scholar.google.com/citations?view_op=view_citation&hl=en&user=tpPPHnMAAAAJ&citation_for_view=tpPPHnMAAAAJ:sSrBHYA8nusC,Stefan Weigert,2009/1/1,Phys. Rev. A,,,"['S Brierley', 'S Weigert']",S Brierley,['S Weigert']
29799106,Maximal sets of mutually unbiased quantum states in dimension 6,110,2008,https://scholar.google.com/citations?view_op=view_citation&hl=en&user=tpPPHnMAAAAJ&citation_for_view=tpPPHnMAAAAJ:9yKSN-GCB0IC,Stefan Weigert,2008/10/13,Physical Review A,,,"['Stephen Brierley', 'Stefan Weigert']",Stephen Brierley,['Stefan Weigert']
16779376,The problem of quantum integrability,96,1992,https://scholar.google.com/citations?view_op=view_citation&hl=en&user=tpPPHnMAAAAJ&citation_for_view=tpPPHnMAAAAJ:UeHWp8X0CEIC,Stefan Weigert,1992/4/1,Physica D: Nonlinear Phenomena,,,['Stefan Weigert'],Stefan Weigert,
89495457,Frequency shifts of cantilevers vibrating in various media,86,1996,https://scholar.google.com/citations?view_op=view_citation&hl=en&user=tpPPHnMAAAAJ&citation_for_view=tpPPHnMAAAAJ:u-x6o8ySG0sC,Stefan Weigert,1996/11/4,Applied Physics Letters,,,"['Stefan Weigert', 'Markus Dreier', 'Martin Hegner']",Stefan Weigert,"['Markus Dreier', 'Martin Hegner']"
95535244,Completeness and orthonormality in PT-symmetric quantum systems,82,2003,https://scholar.google.com/citations?view_op=view_citation&hl=en&user=tpPPHnMAAAAJ&citation_for_view=tpPPHnMAAAAJ:kNdYIx-mwKoC,Stefan Weigert,2003/12/30,Physical Review A,,,['Stefan Weigert'],Stefan Weigert,
26037306,Quantum time evolution in terms of nonredundant probabilities,81,2000,https://scholar.google.com/citations?view_op=view_citation&hl=en&user=tpPPHnMAAAAJ&citation_for_view=tpPPHnMAAAAJ:u5HHmVD_uO8C,Stefan Weigert,2000/1/31,Physical Review Letters,,,['Stefan Weigert'],Stefan Weigert,
89083050,Pauli problem for a spin of arbitrary length: A simple method to determine its wave function,77,1992,https://scholar.google.com/citations?view_op=view_citation&hl=en&user=tpPPHnMAAAAJ&citation_for_view=tpPPHnMAAAAJ:qjMakFHDy7sC,Stefan Weigert,1992/6/1,Physical Review A,,,['Stefan Weigert'],Stefan Weigert,
42895926,Adiabatic motion of a neutral spinning particle in an inhomogeneous magnetic field,68,1993,https://scholar.google.com/citations?view_op=view_citation&hl=en&user=tpPPHnMAAAAJ&citation_for_view=tpPPHnMAAAAJ:d1gkVwhDpl0C,Stefan Weigert,1993/8/1,Physical Review A,,,"['Robert G Littlejohn', 'Stefan Weigert']",Robert G Littlejohn,['Stefan Weigert']
36824843,All mutually unbiased product bases in dimension 6,65,2012,https://scholar.google.com/citations?view_op=view_citation&hl=en&user=tpPPHnMAAAAJ&citation_for_view=tpPPHnMAAAAJ:olpn-zPbct0C,Stefan Weigert,2012/3/20,Journal of Physics A: Mathematical and Theoretical,,,"['Daniel McNulty', 'Stefan Weigert']",Daniel McNulty,['Stefan Weigert']
38001953,Discrete Moyal-type representations for a spin,61,2000,https://scholar.google.com/citations?view_op=view_citation&hl=en&user=tpPPHnMAAAAJ&citation_for_view=tpPPHnMAAAAJ:W7OEmFMy1HYC,Stefan Weigert,2000/12/8,Physical Review A,,,"['Stephan Heiss', 'Stefan Weigert']",Stephan Heiss,['Stefan Weigert']
37071803,Diagonalization of multicomponent wave equations with a Born-Oppenheimer example,61,1993,https://scholar.google.com/citations?view_op=view_citation&hl=en&user=tpPPHnMAAAAJ&citation_for_view=tpPPHnMAAAAJ:IjCSPb-OGe4C,Stefan Weigert,1993/5/1,Physical Review A,,,"['Stefan Weigert', 'Robert G Littlejohn']",Stefan Weigert,['Robert G Littlejohn']
12645822,How to determine a quantum state by measurements: The Pauli problem for a particle with arbitrary potential,58,1996,https://scholar.google.com/citations?view_op=view_citation&hl=en&user=tpPPHnMAAAAJ&citation_for_view=tpPPHnMAAAAJ:2osOgNQ5qMEC,Stefan Weigert,1996/4/1,Physical Review A,,,['Stefan Weigert'],Stefan Weigert,
28038102,Reconstructing the density matrix of a spin s through Stern-Gerlach measurements: II,56,1999,https://scholar.google.com/citations?view_op=view_citation&hl=en&user=tpPPHnMAAAAJ&citation_for_view=tpPPHnMAAAAJ:roLk4NBRz8UC,Stefan Weigert,1999/6/25,Journal of physics A: mathematical and general,,,"['Jean-Pierre Amiet', 'Stefan Weigert']",Jean-Pierre Amiet,['Stefan Weigert']
56232478,Mutually unbiased bases for continuous variables,51,2008,https://scholar.google.com/citations?view_op=view_citation&hl=en&user=tpPPHnMAAAAJ&citation_for_view=tpPPHnMAAAAJ:Se3iqnhoufwC,Stefan Weigert,2008/8/29,Physical Review A,,,"['Stefan Weigert', 'Michael Wilkinson']",Stefan Weigert,['Michael Wilkinson']
6988029,Baker-Campbell-Hausdorff relation for special unitary groups,51,1997,https://scholar.google.com/citations?view_op=view_citation&hl=en&user=tpPPHnMAAAAJ&citation_for_view=tpPPHnMAAAAJ:eQOLeE2rZwMC,Stefan Weigert,1997/12/21,Journal of Physics A: Mathematical and General,,,['Stefan Weigert'],Stefan Weigert,
61518434,Heisenberg uncertainty relation for three canonical observables,44,2014,https://scholar.google.com/citations?view_op=view_citation&hl=en&user=tpPPHnMAAAAJ&citation_for_view=tpPPHnMAAAAJ:fPk4N6BV_jEC,Stefan Weigert,2014/12/15,Physical Review A,,,"['Spiros Kechrimparis', 'Stefan Weigert']",Spiros Kechrimparis,['Stefan Weigert']
29785430,Reconstructing a pure state of a spin s through three Stern-Gerlach measurements,44,1999,https://scholar.google.com/citations?view_op=view_citation&hl=en&user=tpPPHnMAAAAJ&citation_for_view=tpPPHnMAAAAJ:LkGwnXOMwfcC,Stefan Weigert,1999/4/16,Journal of Physics A: Mathematical and General,,,"['Jean-Pierre Amiet', 'Stefan Weigert']",Jean-Pierre Amiet,['Stefan Weigert']
38489179,Mutually unbiased bases and semi-definite programming,38,2010,https://scholar.google.com/citations?view_op=view_citation&hl=en&user=tpPPHnMAAAAJ&citation_for_view=tpPPHnMAAAAJ:YOwf2qJgpHMC,Stefan Weigert,2010/11/1,Journal of Physics: Conference Series,,,"['Stephen Brierley', 'Stefan Weigert']",Stephen Brierley,['Stefan Weigert']
93455741,Quantum correlation games,38,2004,https://scholar.google.com/citations?view_op=view_citation&hl=en&user=tpPPHnMAAAAJ&citation_for_view=tpPPHnMAAAAJ:Tyk-4Ss8FVUC,Stefan Weigert,2004/5/18,Journal of Physics A: Mathematical and General,,,"['Azhar Iqbal', 'Stefan Weigert']",Azhar Iqbal,['Stefan Weigert']
49706368,Coherent states and the reconstruction of pure spin states,38,1999,https://scholar.google.com/citations?view_op=view_citation&hl=en&user=tpPPHnMAAAAJ&cstart=20&pagesize=80&citation_for_view=tpPPHnMAAAAJ:KlAtU1dfN6UC,Stefan Weigert,1999/10/1,Journal of Optics B: Quantum and Semiclassical Optics,,,"['Jean-Pierre Amiet', 'Stefan Weigert']",Jean-Pierre Amiet,['Stefan Weigert']
43828330,PT-symmetry and its spontaneous breakdown explained by anti-linearity,37,2003,https://scholar.google.com/citations?view_op=view_citation&hl=en&user=tpPPHnMAAAAJ&cstart=20&pagesize=80&citation_for_view=tpPPHnMAAAAJ:dfsIfKJdRG4C,Stefan Weigert,2003/6/1,Journal of Optics B: Quantum and Semiclassical Optics,,,['Stefan Weigert'],Stefan Weigert,
72473975,On the impossibility to extend triples of mutually unbiased product bases in dimension six,31,2012,https://scholar.google.com/citations?view_op=view_citation&hl=en&user=tpPPHnMAAAAJ&cstart=20&pagesize=80&citation_for_view=tpPPHnMAAAAJ:GnPB-g6toBAC,Stefan Weigert,2012/8/11,International Journal of Quantum Information,,,"['Daniel McNulty', 'Stefan Weigert']",Daniel McNulty,['Stefan Weigert']
26975470,Contracting the Wigner kernel of a spin to the Wigner kernel of a particle,28,2000,https://scholar.google.com/citations?view_op=view_citation&hl=en&user=tpPPHnMAAAAJ&cstart=20&pagesize=80&citation_for_view=tpPPHnMAAAAJ:MXK_kJrjxJIC,Stefan Weigert,2000/12/5,Physical Review A,,,"['Jean-Pierre Amiet', 'Stefan Weigert']",Jean-Pierre Amiet,['Stefan Weigert']
7721181,Quantum integrability and action operators in spin dynamics,27,1995,https://scholar.google.com/citations?view_op=view_citation&hl=en&user=tpPPHnMAAAAJ&cstart=20&pagesize=80&citation_for_view=tpPPHnMAAAAJ:ufrVoPGSRksC,Stefan Weigert,1995/8/1,"Chaos, Solitons & Fractals",,,"['Stefan Weigert', 'Gerhard Müller']",Stefan Weigert,['Gerhard Müller']
17074402,Discrete Q-and P-symbols for spin s,26,2000,https://scholar.google.com/citations?view_op=view_citation&hl=en&user=tpPPHnMAAAAJ&cstart=20&pagesize=80&citation_for_view=tpPPHnMAAAAJ:3fE2CSJIrl8C,Stefan Weigert,2000/4/1,Journal of Optics B: Quantum and Semiclassical Optics,,,"['Jean-Pierre Amiet', 'Stefan Weigert']",Jean-Pierre Amiet,['Stefan Weigert']
55761391,Electric conductivity near the percolation transition of a nonionic water-in-oil microemulsion,26,1997,https://scholar.google.com/citations?view_op=view_citation&hl=en&user=tpPPHnMAAAAJ&cstart=20&pagesize=80&citation_for_view=tpPPHnMAAAAJ:WF5omc3nYNoC,Stefan Weigert,1997/8/1,Physica A: Statistical Mechanics and its Applications,,,"['Stefan Weigert', 'Hans-Friedrich Eicke', 'Wolfgang Meier']",Stefan Weigert,"['Hans-Friedrich Eicke', 'Wolfgang Meier']"
66507272,Simple minimal informationally complete measurements for qudits,24,2006,https://scholar.google.com/citations?view_op=view_citation&hl=en&user=tpPPHnMAAAAJ&cstart=20&pagesize=80&citation_for_view=tpPPHnMAAAAJ:ULOm3_A8WrAC,Stefan Weigert,2006/5/20,International Journal of Modern Physics B,,,['Stefan Weigert'],Stefan Weigert,
61025584,The physical interpretation of PT-invariant potentials,21,2004,https://scholar.google.com/citations?view_op=view_citation&hl=en&user=tpPPHnMAAAAJ&cstart=20&pagesize=80&citation_for_view=tpPPHnMAAAAJ:Zph67rFs4hoC,Stefan Weigert,2004/10/1,Czechoslovak Journal of Physics,,,['Stefan Weigert'],Stefan Weigert,
48559444,Quantum chaos in the configurational quantum cat map,21,1993,https://scholar.google.com/citations?view_op=view_citation&hl=en&user=tpPPHnMAAAAJ&cstart=20&pagesize=80&citation_for_view=tpPPHnMAAAAJ:_FxGoFyzp5QC,Stefan Weigert,1993/9/1,Physical Review A,,,['Stefan Weigert'],Stefan Weigert,
3117447,Optimal detection of rotations about unknown axes by coherent and anticoherent states,20,2020,https://scholar.google.com/citations?view_op=view_citation&hl=en&user=tpPPHnMAAAAJ&cstart=20&pagesize=80&citation_for_view=tpPPHnMAAAAJ:VOx2b1Wkg3QC,Stefan Weigert,2020/6/22,Quantum,,,"['John Martin', 'Stefan Weigert', 'Olivier Giraud']",John Martin,"['Stefan Weigert', 'Olivier Giraud']"
10258974,Commensurate harmonic oscillators: Classical symmetries,19,2002,https://scholar.google.com/citations?view_op=view_citation&hl=en&user=tpPPHnMAAAAJ&cstart=20&pagesize=80&citation_for_view=tpPPHnMAAAAJ:mB3voiENLucC,Stefan Weigert,2002/8/1,Journal of Mathematical Physics,,,"['Jean-Pierre Amiet', 'Stefan Weigert']",Jean-Pierre Amiet,['Stefan Weigert']
58304687,Quantum parametric resonance,18,2002,https://scholar.google.com/citations?view_op=view_citation&hl=en&user=tpPPHnMAAAAJ&cstart=20&pagesize=80&citation_for_view=tpPPHnMAAAAJ:QIV2ME_5wuYC,Stefan Weigert,2002/4/26,Journal of Physics A: Mathematical and General,,,['Stefan Weigert'],Stefan Weigert,
34916764,Mutually unbiased product bases for multiple qudits,17,2016,https://scholar.google.com/citations?view_op=view_citation&hl=en&user=tpPPHnMAAAAJ&cstart=20&pagesize=80&citation_for_view=tpPPHnMAAAAJ:pyW8ca7W8N0C,Stefan Weigert,2016/3/1,Journal of Mathematical Physics,,,"['Daniel McNulty', 'Bogdan Pammer', 'Stefan Weigert']",Daniel McNulty,"['Bogdan Pammer', 'Stefan Weigert']"
81941687,How to test for diagonalizability: the discretized PT-invariant square-well potential,16,2005,https://scholar.google.com/citations?view_op=view_citation&hl=en&user=tpPPHnMAAAAJ&cstart=20&pagesize=80&citation_for_view=tpPPHnMAAAAJ:0EnyYjriUFMC,Stefan Weigert,2005/9/1,Czechoslovak Journal of Physics,,,['Stefan Weigert'],Stefan Weigert,
9800619,Isolated Hadamard matrices from mutually unbiased product bases,15,2012,https://scholar.google.com/citations?view_op=view_citation&hl=en&user=tpPPHnMAAAAJ&cstart=20&pagesize=80&citation_for_view=tpPPHnMAAAAJ:2P1L_qKh6hAC,Stefan Weigert,2012/1/1,Journal of Mathematical Physics,,,"['Daniel McNulty', 'Stefan Weigert']",Daniel McNulty,['Stefan Weigert']
18307276,Spatial squeezing of the vacuum and the Casimir effect,15,1996,https://scholar.google.com/citations?view_op=view_citation&hl=en&user=tpPPHnMAAAAJ&cstart=20&pagesize=80&citation_for_view=tpPPHnMAAAAJ:hqOjcs7Dif8C,Stefan Weigert,1996/5/20,Physics Letters A,,,['Stefan Weigert'],Stefan Weigert,
25078568,A Gleason-type theorem for qubits based on mixtures of projective measurements,14,2019,https://scholar.google.com/citations?view_op=view_citation&hl=en&user=tpPPHnMAAAAJ&cstart=20&pagesize=80&citation_for_view=tpPPHnMAAAAJ:tOudhMTPpwUC,Stefan Weigert,2019/1/10,Journal of Physics A: Mathematical and Theoretical,,,"['Victoria J Wright', 'Stefan Weigert']",Victoria J Wright,['Stefan Weigert']
73421344,Detecting broken PT-symmetry,14,2006,https://scholar.google.com/citations?view_op=view_citation&hl=en&user=tpPPHnMAAAAJ&cstart=20&pagesize=80&citation_for_view=tpPPHnMAAAAJ:M3ejUd6NZC8C,Stefan Weigert,2006/7/26,Journal of Physics A: Mathematical and General,,,['Stefan Weigert'],Stefan Weigert,
25336023,The Gram matrix of a PT-symmetric quantum system,14,2004,https://scholar.google.com/citations?view_op=view_citation&hl=en&user=tpPPHnMAAAAJ&cstart=20&pagesize=80&citation_for_view=tpPPHnMAAAAJ:qxL8FJ1GzNcC,Stefan Weigert,2004/1/1,Czechoslovak Journal of Physics,,,['Stefan Weigert'],Stefan Weigert,
93284465,Geometry of uncertainty relations for linear combinations of position and momentum,13,2017,https://scholar.google.com/citations?view_op=view_citation&hl=en&user=tpPPHnMAAAAJ&cstart=20&pagesize=80&citation_for_view=tpPPHnMAAAAJ:u9iWguZQMMsC,Stefan Weigert,2017/12/11,Journal of Physics A: Mathematical and Theoretical,,,"['Spiros Kechrimparis', 'Stefan Weigert']",Spiros Kechrimparis,['Stefan Weigert']
5593333,Topological quenching of the tunnel splitting for a particle in a double-well potential on a planar loop,13,1994,https://scholar.google.com/citations?view_op=view_citation&hl=en&user=tpPPHnMAAAAJ&cstart=20&pagesize=80&citation_for_view=tpPPHnMAAAAJ:4TOpqqG69KYC,Stefan Weigert,1994/12/1,Physical Review A,,,['Stefan Weigert'],Stefan Weigert,
97934672,Topologically quenched tunnel splitting in a spin system obtained from quantum-mechanical perturbation theory,13,1994,https://scholar.google.com/citations?view_op=view_citation&hl=en&user=tpPPHnMAAAAJ&cstart=20&pagesize=80&citation_for_view=tpPPHnMAAAAJ:5nxA0vEk-isC,Stefan Weigert,1994/1/1,EPL (Europhysics Letters),,,['S Weigert'],S Weigert,
79346206,Chaos and quantum-nondemolition measurements,13,1991,https://scholar.google.com/citations?view_op=view_citation&hl=en&user=tpPPHnMAAAAJ&cstart=20&pagesize=80&citation_for_view=tpPPHnMAAAAJ:8k81kl-MbHgC,Stefan Weigert,1991/6/1,Physical Review A,,,['Stefan Weigert'],Stefan Weigert,
69408671,"Small denominators, frequency operators, and Lie transforms for nearly integrable quantum spin systems",10,1996,https://scholar.google.com/citations?view_op=view_citation&hl=en&user=tpPPHnMAAAAJ&cstart=20&pagesize=80&citation_for_view=tpPPHnMAAAAJ:dhFuZR0502QC,Stefan Weigert,1996/5/1,Physical Review A,,,"['Thomas Gramespacher', 'Stefan Weigert']",Thomas Gramespacher,['Stefan Weigert']
94676612,Universality in Uncertainty Relations for a Quantum Particle,9,2016,https://scholar.google.com/citations?view_op=view_citation&hl=en&user=tpPPHnMAAAAJ&cstart=20&pagesize=80&citation_for_view=tpPPHnMAAAAJ:D03iK_w7-QYC,Stefan Weigert,2016/1/1,Journal of Physics A: Mathematical and Theoretical,,,"['Spiros Kechrimparis', 'Stefan Weigert']",Spiros Kechrimparis,['Stefan Weigert']
59978838,Affine constellations without mutually unbiased counterparts,9,2010,https://scholar.google.com/citations?view_op=view_citation&hl=en&user=tpPPHnMAAAAJ&cstart=20&pagesize=80&citation_for_view=tpPPHnMAAAAJ:hC7cP41nSMkC,Stefan Weigert,2010/9/9,Journal of Physics A: Mathematical and Theoretical,,,"['Stefan Weigert', 'Thomas Durt']",Stefan Weigert,['Thomas Durt']
35842391,Upper quantum Lyapunov exponent and Anosov relations for quantum systems driven by a classical flow,9,2007,https://scholar.google.com/citations?view_op=view_citation&hl=en&user=tpPPHnMAAAAJ&cstart=20&pagesize=80&citation_for_view=tpPPHnMAAAAJ:L8Ckcad2t8MC,Stefan Weigert,2007/5/1,Journal of Statistical Physics,,,"['O Sapin', 'HR Jauslin', 'Stefan Weigert']",O Sapin,"['HR Jauslin', 'Stefan Weigert']"
45917986,An algorithmic test for diagonalizability of finite-dimensional PT-invariant systems,9,2005,https://scholar.google.com/citations?view_op=view_citation&hl=en&user=tpPPHnMAAAAJ&cstart=20&pagesize=80&citation_for_view=tpPPHnMAAAAJ:7PzlFSSx8tAC,Stefan Weigert,2005/12/7,Journal of Physics A: Mathematical and General,,,['Stefan Weigert'],Stefan Weigert,
25283827,Solvable three-state model of a driven double-well potential and coherent destruction of tunneling,9,1998,https://scholar.google.com/citations?view_op=view_citation&hl=en&user=tpPPHnMAAAAJ&cstart=20&pagesize=80&citation_for_view=tpPPHnMAAAAJ:_kc_bZDykSQC,Stefan Weigert,1998/1/1,Physical Review A,,,"['Laro Schatzer', 'Stefan Weigert']",Laro Schatzer,['Stefan Weigert']
65113859,Quantum Particle on a Rotating Loop: Topological Quenching due to a Coriolis-Aharonov-Bohm Effect,9,1995,https://scholar.google.com/citations?view_op=view_citation&hl=en&user=tpPPHnMAAAAJ&cstart=20&pagesize=80&citation_for_view=tpPPHnMAAAAJ:mVmsd5A6BfQC,Stefan Weigert,1995/8/21,Physical Review Letters,,,['Stefan Weigert'],Stefan Weigert,
88592776,Classical degeneracy and the existence of additional constants of motion,8,1993,https://scholar.google.com/citations?view_op=view_citation&hl=en&user=tpPPHnMAAAAJ&cstart=20&pagesize=80&citation_for_view=tpPPHnMAAAAJ:Wp0gIr-vW9MC,Stefan Weigert,1993/3/1,American Journal of Physics,,,"['Stefan Weigert', 'Harry Thomas']",Stefan Weigert,['Harry Thomas']
84936358,General probabilistic theories with a Gleason-type theorem,7,2021,https://scholar.google.com/citations?view_op=view_citation&hl=en&user=tpPPHnMAAAAJ&cstart=20&pagesize=80&citation_for_view=tpPPHnMAAAAJ:LPZeul_q3PIC,Stefan Weigert,2021/11/25,Quantum,,,"['Victoria J Wright', 'Stefan Weigert']",Victoria J Wright,['Stefan Weigert']
23752038,Preparational Uncertainty Relations for N Continuous Variables,7,2016,https://scholar.google.com/citations?view_op=view_citation&hl=en&user=tpPPHnMAAAAJ&cstart=20&pagesize=80&citation_for_view=tpPPHnMAAAAJ:EUQCXRtRnyEC,Stefan Weigert,2016/6/19,Mathematics,,,"['Spiros Kechrimparis', 'Stefan Weigert']",Spiros Kechrimparis,['Stefan Weigert']
64738596,Landscape of uncertainty in Hilbert space for one-particle states,7,1996,https://scholar.google.com/citations?view_op=view_citation&hl=en&user=tpPPHnMAAAAJ&cstart=20&pagesize=80&citation_for_view=tpPPHnMAAAAJ:aqlVkmm33-oC,Stefan Weigert,1996/4/1,Physical Review A,,,['Stefan Weigert'],Stefan Weigert,
81631176,No-cloning theorem,6,2009,https://scholar.google.com/citations?view_op=view_citation&hl=en&user=tpPPHnMAAAAJ&cstart=20&pagesize=80&citation_for_view=tpPPHnMAAAAJ:k_IJM867U9cC,Stefan Weigert,2009/7/25,,,,['Stefan Weigert'],Stefan Weigert,
74925919,Gleason-type Theorems from Cauchy's Functional Equation,4,2019,https://scholar.google.com/citations?view_op=view_citation&hl=en&user=tpPPHnMAAAAJ&cstart=20&pagesize=80&citation_for_view=tpPPHnMAAAAJ:geHnlv5EZngC,Stefan Weigert,2019/1/1,Foundations of Physics,,,"['Victoria J Wright', 'Stefan Weigert']",Victoria J Wright,['Stefan Weigert']
90042854,Expanding Hermitian operators in a basis of projectors on coherent spin states,4,2004,https://scholar.google.com/citations?view_op=view_citation&hl=en&user=tpPPHnMAAAAJ&cstart=20&pagesize=80&citation_for_view=tpPPHnMAAAAJ:4DMP91E08xMC,Stefan Weigert,2004/10/15,Journal of Optics B: Quantum and Semiclassical Optics,,,['Stefan Weigert'],Stefan Weigert,
31911202,Reconstruction of quantum states and its conceptual implications,4,2000,https://scholar.google.com/citations?view_op=view_citation&hl=en&user=tpPPHnMAAAAJ&cstart=20&pagesize=80&citation_for_view=tpPPHnMAAAAJ:4OULZ7Gr8RgC,Stefan Weigert,2000/1/22,"Trends in quantum mechanics (HD Doebner, ST Ali, M. Keyl and RF Werner, editors)",,,['STEFAN Weigert'],STEFAN Weigert,
68829088,Uncertainty relations for the support of quantum states,2,2022,https://scholar.google.com/citations?view_op=view_citation&hl=en&user=tpPPHnMAAAAJ&cstart=20&pagesize=80&citation_for_view=tpPPHnMAAAAJ:V3AGJWp-ZtQC,Stefan Weigert,2022/12/19,Journal of Physics A: Mathematical and Theoretical,,,"['Vincenzo Fiorentino', 'Stefan Weigert']",Vincenzo Fiorentino,['Stefan Weigert']
14361504,Lüders theorem for coherent-state POVMs,2,2003,https://scholar.google.com/citations?view_op=view_citation&hl=en&user=tpPPHnMAAAAJ&cstart=20&pagesize=80&citation_for_view=tpPPHnMAAAAJ:BqipwSGYUEgC,Stefan Weigert,2003/12/1,Journal of Mathematical Physics,,,"['Stefan Weigert', 'Paul Busch']",Stefan Weigert,['Paul Busch']
50329415,Quantum Diagonalization of Hermitean Matrices,2,2000,https://scholar.google.com/citations?view_op=view_citation&hl=en&user=tpPPHnMAAAAJ&cstart=20&pagesize=80&citation_for_view=tpPPHnMAAAAJ:cFHS6HbyZ2cC,Stefan Weigert,2000/1/1,Journal of Physics A: Mathematical and General,,,['Stefan Weigert'],Stefan Weigert,
15277010,Gauge transformations for a driven quantum particle in an infinite square well,2,1999,https://scholar.google.com/citations?view_op=view_citation&hl=en&user=tpPPHnMAAAAJ&cstart=20&pagesize=80&citation_for_view=tpPPHnMAAAAJ:hFOr9nPyWt4C,Stefan Weigert,1999/11/1,Foundations of Physics,,,['Stefan Weigert'],Stefan Weigert,
93648052,A discrete phase-space calculus for quantum spins based on a reconstruction method using coherent states,2,1999,https://scholar.google.com/citations?view_op=view_citation&hl=en&user=tpPPHnMAAAAJ&cstart=20&pagesize=80&citation_for_view=tpPPHnMAAAAJ:qUcmZB5y_30C,Stefan Weigert,1999/4/28,arXiv preprint quant-ph/9904095,,,['Stefan Weigert'],Stefan Weigert,
81537425,Many-path interference and topologically suppressed tunneling,2,1998,https://scholar.google.com/citations?view_op=view_citation&hl=en&user=tpPPHnMAAAAJ&cstart=20&pagesize=80&citation_for_view=tpPPHnMAAAAJ:-f6ydRqryjwC,Stefan Weigert,1998/6/15,Europhysics Letters,,,"['S Weigert', 'I Herger']",S Weigert,['I Herger']
7937803,Wissenschaftliche Darstellungsformen und Uneigentliches Sprechen,2,1998,https://scholar.google.com/citations?view_op=view_citation&hl=en&user=tpPPHnMAAAAJ&cstart=20&pagesize=80&citation_for_view=tpPPHnMAAAAJ:abG-DnoFyZgC,Stefan Weigert,1998/1/1,,,,['Stefan Weigert'],Stefan Weigert,
51299217,Hamiltonian Chaos IV,2,1996,https://scholar.google.com/citations?view_op=view_citation&hl=en&user=tpPPHnMAAAAJ&cstart=20&pagesize=80&citation_for_view=tpPPHnMAAAAJ:IWHjjKOFINEC,Stefan Weigert,1996/1/1,Computers in Physics,,,"['Nicolas Regez', 'Wolfgang Breymann', 'Stefan Weigert', 'Charles Kaufman', 'Gerhard Müller']",Nicolas Regez,"['Wolfgang Breymann', 'Stefan Weigert', 'Charles Kaufman', 'Gerhard Müller']"
17615227,"Quantum groups, quantum foundations and quantum information: a Festschrift for Tony Sudbery",1,2010,https://scholar.google.com/citations?view_op=view_citation&hl=en&user=tpPPHnMAAAAJ&cstart=20&pagesize=80&citation_for_view=tpPPHnMAAAAJ:e5wmG9Sq2KIC,Stefan Weigert,2010/11/19,,Journal of Physics: Conference Series,,['Stefan Weigert'],Stefan Weigert,
78697801,A quantum search for zeros of polynomials,1,2003,https://scholar.google.com/citations?view_op=view_citation&hl=en&user=tpPPHnMAAAAJ&cstart=20&pagesize=80&citation_for_view=tpPPHnMAAAAJ:bEWYMUwI8FkC,Stefan Weigert,2003/10/16,Journal of Optics B: Quantum and Semiclassical Optics,,,['Stefan Weigert'],Stefan Weigert,
94567768,Keeping track of chaos by quantum-nondemolition measurements,1,1992,https://scholar.google.com/citations?view_op=view_citation&hl=en&user=tpPPHnMAAAAJ&cstart=20&pagesize=80&citation_for_view=tpPPHnMAAAAJ:isC4tDSrTZIC,Stefan Weigert,1992/1/31,,,,['Stefan Weigert'],Stefan Weigert,
47070790,Stretching and folding in the configurational quantum cat map,1,1991,https://scholar.google.com/citations?view_op=view_citation&hl=en&user=tpPPHnMAAAAJ&cstart=20&pagesize=80&citation_for_view=tpPPHnMAAAAJ:u_35RYKgDlwC,Stefan Weigert,1991/1/1,,,,['S Weigert'],S Weigert,
75652745,A Quantum Theory with Non-collapsing Measurements,,2023,https://scholar.google.com/citations?view_op=view_citation&hl=en&user=tpPPHnMAAAAJ&cstart=20&pagesize=80&citation_for_view=tpPPHnMAAAAJ:bnK-pcrLprsC,Stefan Weigert,2023/3/23,arXiv preprint arXiv:2303.13411,,,"['Vincenzo Fiorentino', 'Stefan Weigert']",Vincenzo Fiorentino,['Stefan Weigert']
77670702,"""Herr Johannes Körmözzi aus Siebenbürgen hat meine sämtlichen Vorlesungen [...] mit unausgeseztem Fleiße besucht"" - Aufzeichnungen des ungarischen Studenten János Körmöczi nach …",,2021,https://scholar.google.com/citations?view_op=view_citation&hl=en&user=tpPPHnMAAAAJ&cstart=20&pagesize=80&citation_for_view=tpPPHnMAAAAJ:eflP2zaiRacC,Stefan Weigert,2021/1/1,,,,"['Dezső Gurka', 'Stefan Weigert']",Dezső Gurka,['Stefan Weigert']
69210341,Paul Busch: Contributions to Quantum Theory,,2020,https://scholar.google.com/citations?view_op=view_citation&hl=en&user=tpPPHnMAAAAJ&cstart=20&pagesize=80&citation_for_view=tpPPHnMAAAAJ:eJXPG6dFmWUC,Stefan Weigert,2020/10/1,Journal of Physics: Conference Series,,,"['Roger Colbeck', 'Leon Loveridge', 'Stefan Weigert']",Roger Colbeck,"['Leon Loveridge', 'Stefan Weigert']"
